{"$schema":"https://json-schema.org/draft/2020-12/schema","$id":"https://commandf.dev/schemas/af02-surface-policy-v1.schema.json","title":"commandf.af02-surface-policy/v1","type":"object","additionalProperties":false,"required":["schema","lineage","source_sha","source_tree","source_roots","exclusion_policy_sha256","scanner_tool_id","boundary_categories","matchers","critical_surfaces","known_boundary_witnesses","finding_exclusions"],"properties":{"schema":{"const":"commandf.af02-surface-policy/v1"},"lineage":{"$ref":"#/$defs/lineage"},"source_sha":{"type":"string","pattern":"^[0-9a-f]{40}$"},"source_tree":{"type":"string","pattern":"^[0-9a-f]{40}$"},"source_roots":{"const":["crates/**/src/**/*.rs","tools/**/src/**/*.rs"]},"exclusion_policy_sha256":{"type":"string","pattern":"^[0-9a-f]{64}$"},"scanner_tool_id":{"const":"syn-af02-scanner"},"boundary_categories":{"const":["ARCHIVE_OR_COMPRESSION","CACHE_OR_PERSISTENCE","FILESYSTEM","NETWORK_OR_ACQUISITION","SERDE_OR_TEXT_PARSE","SUBPROCESS"]},"matchers":{"type":"array","minItems":6,"uniqueItems":true,"items":{"$ref":"#/$defs/matcher"}},"critical_surfaces":{"type":"array","minItems":6,"uniqueItems":true,"items":{"$ref":"#/$defs/surface"}},"known_boundary_witnesses":{"type":"array","minItems":6,"uniqueItems":true,"items":{"$ref":"#/$defs/witness"}},"finding_exclusions":{"type":"array","uniqueItems":true,"items":{"$ref":"#/$defs/findingExclusion"}}},"allOf":[{"properties":{"matchers":{"contains":{"type":"object","properties":{"category":{"const":"ARCHIVE_OR_COMPRESSION"}},"required":["category"]},"minContains":1}}},{"properties":{"critical_surfaces":{"contains":{"type":"object","properties":{"category":{"const":"ARCHIVE_OR_COMPRESSION"}},"required":["category"]},"minContains":1}}},{"properties":{"known_boundary_witnesses":{"contains":{"type":"object","properties":{"category":{"const":"ARCHIVE_OR_COMPRESSION"}},"required":["category"]},"minContains":1}}},{"properties":{"matchers":{"contains":{"type":"object","properties":{"category":{"const":"CACHE_OR_PERSISTENCE"}},"required":["category"]},"minContains":1}}},{"properties":{"critical_surfaces":{"contains":{"type":"object","properties":{"category":{"const":"CACHE_OR_PERSISTENCE"}},"required":["category"]},"minContains":1}}},{"properties":{"known_boundary_witnesses":{"contains":{"type":"object","properties":{"category":{"const":"CACHE_OR_PERSISTENCE"}},"required":["category"]},"minContains":1}}},{"properties":{"matchers":{"contains":{"type":"object","properties":{"category":{"const":"FILESYSTEM"}},"required":["category"]},"minContains":1}}},{"properties":{"critical_surfaces":{"contains":{"type":"object","properties":{"category":{"const":"FILESYSTEM"}},"required":["category"]},"minContains":1}}},{"properties":{"known_boundary_witnesses":{"contains":{"type":"object","properties":{"category":{"const":"FILESYSTEM"}},"required":["category"]},"minContains":1}}},{"properties":{"matchers":{"contains":{"type":"object","properties":{"category":{"const":"NETWORK_OR_ACQUISITION"}},"required":["category"]},"minContains":1}}},{"properties":{"critical_surfaces":{"contains":{"type":"object","properties":{"category":{"const":"NETWORK_OR_ACQUISITION"}},"required":["category"]},"minContains":1}}},{"properties":{"known_boundary_witnesses":{"contains":{"type":"object","properties":{"category":{"const":"NETWORK_OR_ACQUISITION"}},"required":["category"]},"minContains":1}}},{"properties":{"matchers":{"contains":{"type":"object","properties":{"category":{"const":"SERDE_OR_TEXT_PARSE"}},"required":["category"]},"minContains":1}}},{"properties":{"critical_surfaces":{"contains":{"type":"object","properties":{"category":{"const":"SERDE_OR_TEXT_PARSE"}},"required":["category"]},"minContains":1}}},{"properties":{"known_boundary_witnesses":{"contains":{"type":"object","properties":{"category":{"const":"SERDE_OR_TEXT_PARSE"}},"required":["category"]},"minContains":1}}},{"properties":{"matchers":{"contains":{"type":"object","properties":{"category":{"const":"SUBPROCESS"}},"required":["category"]},"minContains":1}}},{"properties":{"critical_surfaces":{"contains":{"type":"object","properties":{"category":{"const":"SUBPROCESS"}},"required":["category"]},"minContains":1}}},{"properties":{"known_boundary_witnesses":{"contains":{"type":"object","properties":{"category":{"const":"SUBPROCESS"}},"required":["category"]},"minContains":1}}}],"$defs":{"lineage":{"type":"object","additionalProperties":false,"required":["mode","canonical_base_sha","canonical_base_tree","policy_path","predecessor_blob_sha","predecessor_sha256","change_is_policy_only","dependent_evidence_allowed_in_same_candidate","comparison_rule"],"properties":{"mode":{"enum":["BOOTSTRAP","REBASE"]},"canonical_base_sha":{"type":"string","pattern":"^[0-9a-f]{40}$"},"canonical_base_tree":{"type":"string","pattern":"^[0-9a-f]{40}$"},"policy_path":{"const":"specs/016-af-02-adversarial-test-strength/surface-policy.json"},"predecessor_blob_sha":{"oneOf":[{"type":"string","pattern":"^[0-9a-f]{40}$"},{"type":"null"}]},"predecessor_sha256":{"oneOf":[{"type":"string","pattern":"^[0-9a-f]{64}$"},{"type":"null"}]},"change_is_policy_only":{"const":true},"dependent_evidence_allowed_in_same_candidate":{"const":false},"comparison_rule":{"const":"BASE_CONTROLLED_PREDECESSOR_OR_SINGLE_BOOTSTRAP"}},"allOf":[{"if":{"properties":{"mode":{"const":"BOOTSTRAP"}}},"then":{"properties":{"predecessor_blob_sha":{"type":"null"},"predecessor_sha256":{"type":"null"}}}},{"if":{"properties":{"mode":{"const":"REBASE"}}},"then":{"properties":{"predecessor_blob_sha":{"type":"string","pattern":"^[0-9a-f]{40}$"},"predecessor_sha256":{"type":"string","pattern":"^[0-9a-f]{64}$"}}}}]},"gitSha":{"type":"string","pattern":"^[0-9a-f]{40}$"},"path":{"type":"string","minLength":1,"pattern":"^(?!/)(?!.*\\\\)(?!.*//)(?!.*(?:^|/)\\.(?:/|$))(?!.*(?:^|/)\\.\\.(?:/|$))[^\\u0000]+$"},"id":{"type":"string","minLength":1,"maxLength":160,"pattern":"^[A-Za-z0-9][A-Za-z0-9._:-]*$"},"category":{"enum":["ARCHIVE_OR_COMPRESSION","CACHE_OR_PERSISTENCE","FILESYSTEM","NETWORK_OR_ACQUISITION","SERDE_OR_TEXT_PARSE","SUBPROCESS"]},"matcher":{"type":"object","additionalProperties":false,"required":["matcher_id","category","kind","callee_or_method","import_roots","receiver_constructor_or_null"],"properties":{"matcher_id":{"$ref":"#/$defs/id"},"category":{"$ref":"#/$defs/category"},"kind":{"enum":["PATH_CALL","METHOD_CALL","MACRO_TOKEN","TYPE_CONSTRUCTOR"]},"callee_or_method":{"type":"string","minLength":1,"maxLength":256},"import_roots":{"type":"array","items":{"type":"string","minLength":1,"maxLength":256},"uniqueItems":true},"receiver_constructor_or_null":{"oneOf":[{"type":"string","minLength":1,"maxLength":256},{"type":"null"}]}}},"surface":{"type":"object","additionalProperties":false,"required":["surface_id","category","matcher_ids","source_paths"],"properties":{"surface_id":{"$ref":"#/$defs/id"},"category":{"$ref":"#/$defs/category"},"matcher_ids":{"type":"array","minItems":1,"items":{"$ref":"#/$defs/id"},"uniqueItems":true},"source_paths":{"type":"array","minItems":1,"items":{"$ref":"#/$defs/path"},"uniqueItems":true}}},"witness":{"type":"object","additionalProperties":false,"required":["witness_id","category","matcher_id","source_path","source_blob_sha","symbol_or_span"],"properties":{"witness_id":{"$ref":"#/$defs/id"},"category":{"$ref":"#/$defs/category"},"matcher_id":{"$ref":"#/$defs/id"},"source_path":{"$ref":"#/$defs/path"},"source_blob_sha":{"$ref":"#/$defs/gitSha"},"symbol_or_span":{"type":"string","minLength":1,"maxLength":512}}},"findingExclusion":{"type":"object","additionalProperties":false,"required":["exclusion_id","matcher_id","source_path","reason","introduced_policy_sha"],"properties":{"exclusion_id":{"type":"string","pattern":"^SURF-X[0-9]{4}$"},"matcher_id":{"$ref":"#/$defs/id"},"source_path":{"$ref":"#/$defs/path"},"reason":{"type":"string","minLength":20,"maxLength":2048},"introduced_policy_sha":{"$ref":"#/$defs/gitSha"}}}}}