{"boundary_categories":["ARCHIVE_OR_COMPRESSION","CACHE_OR_PERSISTENCE","FILESYSTEM","NETWORK_OR_ACQUISITION","SERDE_OR_TEXT_PARSE","SUBPROCESS"],"critical_surfaces":[{"category":"ARCHIVE_OR_COMPRESSION","matcher_ids":["archive-gzdecoder-new"],"source_paths":["crates/commandf-pkg/src/archive.rs","crates/commandf-pkg/src/artifact_scan.rs"],"surface_id":"archive-gzip-decode"},{"category":"ARCHIVE_OR_COMPRESSION","matcher_ids":["archive-tar-archive-new"],"source_paths":["crates/commandf-pkg/src/archive.rs","crates/commandf-pkg/src/artifact_scan.rs"],"surface_id":"archive-tar-scan"},{"category":"CACHE_OR_PERSISTENCE","matcher_ids":["cache-tempfile-new-in"],"source_paths":["crates/commandf-pkg/src/cache.rs"],"surface_id":"cache-object-persistence"},{"category":"FILESYSTEM","matcher_ids":["filesystem-canonicalize"],"source_paths":["crates/commandf-pkg/src/source_map.rs"],"surface_id":"filesystem-canonicalization"},{"category":"FILESYSTEM","matcher_ids":["filesystem-create-dir-all"],"source_paths":["crates/commandf-pkg/src/cache.rs"],"surface_id":"filesystem-create-directory-tree"},{"category":"FILESYSTEM","matcher_ids":["filesystem-file-open"],"source_paths":["crates/commandf-cli/src/main.rs","crates/commandf-pkg/src/cache.rs","crates/commandf-pkg/src/source_map.rs"],"surface_id":"filesystem-file-open"},{"category":"FILESYSTEM","matcher_ids":["filesystem-metadata"],"source_paths":["crates/commandf-pkg/src/source_map.rs"],"surface_id":"filesystem-metadata-read"},{"category":"FILESYSTEM","matcher_ids":["filesystem-open-options-new"],"source_paths":["crates/commandf-cli/src/main.rs"],"surface_id":"filesystem-open-options"},{"category":"FILESYSTEM","matcher_ids":["filesystem-portable-relative-path"],"source_paths":["crates/commandf-pkg/src/source_map.rs"],"surface_id":"filesystem-portable-relative-path"},{"category":"FILESYSTEM","matcher_ids":["filesystem-read"],"source_paths":["crates/commandf-cli/src/impact.rs","crates/commandf-cli/src/main.rs","crates/commandf-cli/src/oracle.rs","crates/commandf-pkg/src/cache.rs","crates/commandf-pkg/src/source.rs","crates/commandf-pkg/src/terminology_index.rs","tools/af02-verifier/src/main.rs","tools/af02-verifier/src/surface.rs"],"surface_id":"filesystem-read"},{"category":"FILESYSTEM","matcher_ids":["filesystem-read-dir"],"source_paths":["crates/commandf-pkg/src/source.rs"],"surface_id":"filesystem-read-directory"},{"category":"FILESYSTEM","matcher_ids":["filesystem-remove-file"],"source_paths":["crates/commandf-cli/src/main.rs"],"surface_id":"filesystem-remove-file"},{"category":"FILESYSTEM","matcher_ids":["filesystem-rename"],"source_paths":["crates/commandf-cli/src/main.rs"],"surface_id":"filesystem-rename"},{"category":"FILESYSTEM","matcher_ids":["filesystem-write"],"source_paths":["crates/commandf-cli/src/main.rs"],"surface_id":"filesystem-write"},{"category":"NETWORK_OR_ACQUISITION","matcher_ids":["network-agent-config-builder"],"source_paths":["crates/commandf-pkg/src/registry.rs"],"surface_id":"network-agent-configuration"},{"category":"NETWORK_OR_ACQUISITION","matcher_ids":["network-request-call"],"source_paths":["crates/commandf-pkg/src/registry.rs"],"surface_id":"network-request-execution"},{"category":"SERDE_OR_TEXT_PARSE","matcher_ids":["parser-cli-try-parse"],"source_paths":["crates/commandf-cli/src/main.rs"],"surface_id":"parser-cli-arguments"},{"category":"SERDE_OR_TEXT_PARSE","matcher_ids":["parser-context-canonical-target"],"source_paths":["crates/commandf-pkg/src/context.rs"],"surface_id":"parser-context-canonical-target"},{"category":"SERDE_OR_TEXT_PARSE","matcher_ids":["parser-method-parse"],"source_paths":["crates/commandf-pkg/src/compatibility.rs","crates/commandf-pkg/src/model.rs"],"surface_id":"parser-method-parse"},{"category":"SERDE_OR_TEXT_PARSE","matcher_ids":["parser-package-name"],"source_paths":["crates/commandf-cli/src/gate.rs","crates/commandf-cli/src/impact.rs","crates/commandf-cli/src/main.rs","crates/commandf-cli/src/oracle.rs","crates/commandf-pkg/src/lock.rs","crates/commandf-pkg/src/model.rs","crates/commandf-pkg/src/registry.rs","crates/commandf-pkg/src/resolver.rs"],"surface_id":"parser-package-name"},{"category":"SERDE_OR_TEXT_PARSE","matcher_ids":["parser-package-request"],"source_paths":["crates/commandf-cli/src/main.rs"],"surface_id":"parser-package-request"},{"category":"SERDE_OR_TEXT_PARSE","matcher_ids":["parser-semver-version"],"source_paths":["crates/commandf-pkg/src/lock.rs","crates/commandf-pkg/src/model.rs","crates/commandf-pkg/src/registry.rs","crates/commandf-pkg/src/resolver.rs","crates/commandf-pkg/src/source.rs"],"surface_id":"parser-semver-version"},{"category":"SERDE_OR_TEXT_PARSE","matcher_ids":["parser-terminology-canonical-reference"],"source_paths":["crates/commandf-pkg/src/terminology_index.rs"],"surface_id":"parser-terminology-canonical-reference"},{"category":"SERDE_OR_TEXT_PARSE","matcher_ids":["parser-version-constraint"],"source_paths":["crates/commandf-pkg/src/lock.rs","crates/commandf-pkg/src/model.rs","crates/commandf-pkg/src/resolver.rs"],"surface_id":"parser-version-constraint"},{"category":"SERDE_OR_TEXT_PARSE","matcher_ids":["serde-json-from-slice"],"source_paths":["crates/commandf-pkg/src/artifact_diff.rs","crates/commandf-pkg/src/artifact_inspect.rs","crates/commandf-pkg/src/check_model.rs","crates/commandf-pkg/src/context.rs","crates/commandf-pkg/src/gate_model.rs","crates/commandf-pkg/src/lock.rs","crates/commandf-pkg/src/oracle_reconcile.rs","crates/commandf-pkg/src/registry.rs","crates/commandf-pkg/src/source_map.rs","crates/commandf-pkg/src/source_map_model.rs","crates/commandf-pkg/src/terminology_index.rs"],"surface_id":"serde-json-from-slice"},{"category":"SERDE_OR_TEXT_PARSE","matcher_ids":["serde-json-from-str"],"source_paths":["crates/commandf-pkg/src/archive.rs"],"surface_id":"serde-json-from-str"},{"category":"SUBPROCESS","matcher_ids":["subprocess-command-new"],"source_paths":["crates/commandf-pkg/src/oracle_process.rs","tools/af02-verifier/src/surface.rs"],"surface_id":"subprocess-command-construction"}],"exclusion_policy_sha256":"ab6556313416a2c6f63219e085198c233f2fe866735af0bba6e8c78a19b75780","finding_exclusions":[],"known_boundary_witnesses":[{"category":"ARCHIVE_OR_COMPRESSION","matcher_id":"archive-gzdecoder-new","source_blob_sha":"c360cadce4ed0aad9c2a9debaa9e0b9988c51ab6","source_path":"crates/commandf-pkg/src/archive.rs","symbol_or_span":"read_manifest_with_limits: GzDecoder::new(Cursor::new(bytes))","witness_id":"w-archive-gzdecoder"},{"category":"ARCHIVE_OR_COMPRESSION","matcher_id":"archive-tar-archive-new","source_blob_sha":"c360cadce4ed0aad9c2a9debaa9e0b9988c51ab6","source_path":"crates/commandf-pkg/src/archive.rs","symbol_or_span":"read_manifest_with_limits: Archive::new(bounded)","witness_id":"w-archive-tar"},{"category":"CACHE_OR_PERSISTENCE","matcher_id":"cache-tempfile-new-in","source_blob_sha":"a6c34eba4f9cb0b196fe1894f9c7627a3d8206ae","source_path":"crates/commandf-pkg/src/cache.rs","symbol_or_span":"PackageCache::put: NamedTempFile::new_in(parent)","witness_id":"w-cache-tempfile"},{"category":"FILESYSTEM","matcher_id":"filesystem-canonicalize","source_blob_sha":"cd3327ed17818290b911e426aa1831ddd690a982","source_path":"crates/commandf-pkg/src/source_map.rs","symbol_or_span":"build_source_mapped_check_report: fs::canonicalize(repo_root)","witness_id":"w-filesystem-canonicalize"},{"category":"FILESYSTEM","matcher_id":"filesystem-create-dir-all","source_blob_sha":"a6c34eba4f9cb0b196fe1894f9c7627a3d8206ae","source_path":"crates/commandf-pkg/src/cache.rs","symbol_or_span":"PackageCache::put: fs::create_dir_all(parent)","witness_id":"w-filesystem-create-dir-all"},{"category":"FILESYSTEM","matcher_id":"filesystem-file-open","source_blob_sha":"a6c34eba4f9cb0b196fe1894f9c7627a3d8206ae","source_path":"crates/commandf-pkg/src/cache.rs","symbol_or_span":"PackageCache::read_verified_bounded: fs::File::open(&path)","witness_id":"w-filesystem-file-open"},{"category":"FILESYSTEM","matcher_id":"filesystem-metadata","source_blob_sha":"cd3327ed17818290b911e426aa1831ddd690a982","source_path":"crates/commandf-pkg/src/source_map.rs","symbol_or_span":"build_source_mapped_check_report: fs::metadata(&source_canonical)","witness_id":"w-filesystem-metadata"},{"category":"FILESYSTEM","matcher_id":"filesystem-open-options-new","source_blob_sha":"5f40270ad585185f97aa466ec95b0ce72abdc047","source_path":"crates/commandf-cli/src/main.rs","symbol_or_span":"atomic write helper: OpenOptions::new()","witness_id":"w-filesystem-open-options"},{"category":"FILESYSTEM","matcher_id":"filesystem-portable-relative-path","source_blob_sha":"cd3327ed17818290b911e426aa1831ddd690a982","source_path":"crates/commandf-pkg/src/source_map.rs","symbol_or_span":"build_source_mapped_check_report: portable_relative_path(fsh_root_text, ...)","witness_id":"w-filesystem-portable-relative-path"},{"category":"FILESYSTEM","matcher_id":"filesystem-read","source_blob_sha":"7da9da5d9ac791586dcecf68b95e5624eb8a1256","source_path":"crates/commandf-pkg/src/source.rs","symbol_or_span":"LocalMirrorSource::archive: fs::read(path)","witness_id":"w-filesystem-read"},{"category":"FILESYSTEM","matcher_id":"filesystem-read-dir","source_blob_sha":"7da9da5d9ac791586dcecf68b95e5624eb8a1256","source_path":"crates/commandf-pkg/src/source.rs","symbol_or_span":"LocalMirrorSource::available_versions: fs::read_dir(&package_dir)","witness_id":"w-filesystem-read-dir"},{"category":"FILESYSTEM","matcher_id":"filesystem-remove-file","source_blob_sha":"5f40270ad585185f97aa466ec95b0ce72abdc047","source_path":"crates/commandf-cli/src/main.rs","symbol_or_span":"atomic write cleanup: fs::remove_file(&temporary)","witness_id":"w-filesystem-remove-file"},{"category":"FILESYSTEM","matcher_id":"filesystem-rename","source_blob_sha":"5f40270ad585185f97aa466ec95b0ce72abdc047","source_path":"crates/commandf-cli/src/main.rs","symbol_or_span":"atomic write commit: fs::rename(&temporary, path)","witness_id":"w-filesystem-rename"},{"category":"FILESYSTEM","matcher_id":"files